source,author,title,description,url,published_at,content,raw,sentiment_polarity,sentiment_subjectivity,noun_phrases,word_count,adj_ratio,verb_ratio
Futurity: Research News,Sydney Barrilleaux - U. Georgia,tech use may benefit older adults’ well-being,A new study finds that technology use and work force engagement are linked to better social health among older Americans.,https://www.futurity.org/technology-older-adults-health-3303462-2/,2025-11-03 20:00:08+00:00,"a recent study suggests smartphones, computers, and tablets may help older adults stay connected. as a social worker in south korea, jaesung lee, lead author of the study and a doctoral candidate in… [+3964 chars]","{'source': {'id': None, 'name': 'Futurity: Research News'}, 'author': 'Sydney Barrilleaux - U. Georgia', 'title': 'Tech use may benefit older adults’ well-being', 'description': 'A new study finds that technology use and work force engagement are linked to better social health among older Americans.', 'url': 'https://www.futurity.org/technology-older-adults-health-3303462-2/', 'urlToImage': 'https://www.futurity.org/wp/wp-content/uploads/2025/11/older-man-using-phone3_1600.jpg', 'publishedAt': '2025-11-03T20:00:08Z', 'content': 'A recent study suggests smartphones, computers, and tablets may help older adults stay connected.\r\nAs a social worker in South Korea, Jaesung Lee, lead author of the study and a doctoral candidate in… [+3964 chars]'}",0.06666666666666667,0.21666666666666665,"['recent study suggests smartphones', 'social worker', 'jaesung lee', 'lead author', 'doctoral candidate in… [ +3964 chars ]']",35,0.16216216216216217,0.16216216216216217
BGR,staff@bgr.com (Daniel Trock),what does 'sim card' actually mean?,"SIM cards, short for Subscriber Identity Module, have become a universal aspect of modern smartphone usage, but the technology dates more than three decades.",https://www.bgr.com/2008542/what-sim-card-means/,2025-11-03 11:17:00+00:00,"the first commercial sim card was released in 1991 by german company giesecke+devrient, known today as simply g+d. in line with its full name, ""subscriber identity module,"" the original purpose of a … [+1163 chars]","{'source': {'id': None, 'name': 'BGR'}, 'author': 'staff@bgr.com (Daniel Trock)', 'title': ""What Does 'SIM Card' Actually Mean?"", 'description': 'SIM cards, short for Subscriber Identity Module, have become a universal aspect of modern smartphone usage, but the technology dates more than three decades.', 'url': 'https://www.bgr.com/2008542/what-sim-card-means/', 'urlToImage': 'https://www.bgr.com/img/gallery/what-does-sim-card-actually-mean/l-intro-1761582925.jpg', 'publishedAt': '2025-11-03T11:17:00Z', 'content': 'The first commercial SIM card was released in 1991 by German company Giesecke+Devrient, known today as simply G+D. In line with its full name, ""Subscriber Identity Module,"" the original purpose of a … [+1163 chars]'}",0.1625,0.33174603174603173,"['commercial sim card', 'german company giesecke+devrient', 'full name', 'subscriber identity module', 'original purpose', '… [ +1163 chars ]']",35,0.16216216216216217,0.16216216216216217
BGR,staff@bgr.com (Gaurav Shukla),3 cheap tvs that look expensive,"Thanks to evolving technology, a good TV need not be super expensive. Here are three cheap TVs that offer excellent image quality and look premium.",https://www.bgr.com/2007835/cheap-tvs-look-expensive-2025/,2025-11-01 16:47:00+00:00,"panasonic isn't as popular as some other manufacturers in the us, but it has a decent selection of televisions in its portfolio including the panasonic w95a. this is an excellent option for tv shoppe… [+1109 chars]","{'source': {'id': None, 'name': 'BGR'}, 'author': 'staff@bgr.com (Gaurav Shukla)', 'title': '3 Cheap TVs That Look Expensive', 'description': 'Thanks to evolving technology, a good TV need not be super expensive. Here are three cheap TVs that offer excellent image quality and look premium.', 'url': 'https://www.bgr.com/2007835/cheap-tvs-look-expensive-2025/', 'urlToImage': 'https://www.bgr.com/img/gallery/3-cheap-tvs-that-look-expensive/l-intro-1761292957.jpg', 'publishedAt': '2025-11-01T16:47:00Z', 'content': ""Panasonic isn't as popular as some other manufacturers in the US, but it has a decent selection of televisions in its portfolio including the Panasonic W95A.\xa0This is an excellent option for TV shoppe… [+1109 chars]""}",0.41041666666666665,0.7354166666666666,"['decent selection', 'panasonic w95a', 'excellent option', 'tv shoppe… [ +1109 chars ]']",37,0.1282051282051282,0.15384615384615385
Yahoo Entertainment,Reuters,"malaysia pm says $142 million magnet plant to boost rare earth sector, state media reports",KUALA LUMPUR (Reuters) -Malaysian Prime Minister Anwar Ibrahim said the development of a 600 million ringgit ($142 million) super magnet manufacturing...,https://finance.yahoo.com/news/malaysia-pm-says-142-million-024020222.html,2025-11-03 02:40:20+00:00,kuala lumpur (reuters) -malaysian prime minister anwar ibrahim said the development of a 600 million ringgit ($142 million) super magnet manufacturing facility in the state of pahang will strengthen … [+1489 chars],"{'source': {'id': None, 'name': 'Yahoo Entertainment'}, 'author': 'Reuters', 'title': 'Malaysia PM says $142 million magnet plant to boost rare earth sector, state media reports', 'description': 'KUALA LUMPUR (Reuters) -Malaysian Prime Minister Anwar Ibrahim said the development of a 600 million ringgit ($142 million) super magnet manufacturing...', 'url': 'https://finance.yahoo.com/news/malaysia-pm-says-142-million-024020222.html', 'urlToImage': 'https://media.zenfs.com/en/reuters.com/e57fd9e38f7b47aa8ee9a35e59c1fd5a', 'publishedAt': '2025-11-03T02:40:20Z', 'content': 'KUALA LUMPUR (Reuters) -Malaysian Prime Minister Anwar Ibrahim said the development of a 600 million ringgit ($142 million) super magnet manufacturing facility in the state of Pahang will strengthen … [+1489 chars]'}",0.3333333333333333,0.6666666666666666,"['kuala lumpur', 'prime minister anwar ibrahim', 'super magnet', '… [ +1489 chars ]']",32,0.058823529411764705,0.14705882352941177
Uncrate.com,Uncrate,board tabletop game console,Some argue that technology is responsible for the death of family game night. The Board Tabletop Game Console is using it to try and save the tradition. It features a 24-in anti-glare touch display that lays flat on a dining...,https://uncrate.com/board-tabletop-game-console/,2025-11-03 15:00:01+00:00,"nuun sport isn't just hydration it's functional fuel. crafted with clean ingredients and designed by athletes for athletes, this line of electrolyte tablets skips the sugar spike and crash for perfor… [+263 chars]","{'source': {'id': None, 'name': 'Uncrate.com'}, 'author': 'Uncrate', 'title': 'Board Tabletop Game Console', 'description': 'Some argue that technology is responsible for the death of family game night. The Board Tabletop Game Console is using it to try and save the tradition. It features a 24-in anti-glare touch display that lays flat on a dining...', 'url': 'https://uncrate.com/board-tabletop-game-console/', 'urlToImage': 'https://uncrate.com/p/2025/11/board-tabletop-console-1-1.jpg', 'publishedAt': '2025-11-03T15:00:01Z', 'content': ""Nuun Sport isn't just hydration it's functional fuel. Crafted with clean ingredients and designed by athletes for athletes, this line of electrolyte tablets skips the sugar spike and crash for perfor… [+263 chars]""}",0.3666666666666667,0.7000000000000001,"['nuun sport', 'functional fuel', 'clean ingredients', 'electrolyte tablets', 'sugar spike', 'perfor… [ +263 chars ]']",35,0.10810810810810811,0.21621621621621623
Gizmodo.com,Kyle Barr,screw tri-folds: the real innovation is in gaming phones,Now we just need a mobile game that lets the hardware truly sing.,https://gizmodo.com/screw-tri-folds-the-real-innovation-is-in-gaming-phones-2000680736,2025-11-03 16:58:17+00:00,every new iphone or android device that crab-walks onto u.s. shores is visually indistinct from the next. phones have become so standard and boring that were honestly considering ultra-expensive “tri… [+4948 chars],"{'source': {'id': None, 'name': 'Gizmodo.com'}, 'author': 'Kyle Barr', 'title': 'Screw Tri-Folds: The Real Innovation Is in Gaming Phones', 'description': 'Now we just need a mobile game that lets the hardware truly sing.', 'url': 'https://gizmodo.com/screw-tri-folds-the-real-innovation-is-in-gaming-phones-2000680736', 'urlToImage': 'https://gizmodo.com/app/uploads/2025/11/REDMAGIC-11-Pro-1-1200x675.jpg', 'publishedAt': '2025-11-03T16:58:17Z', 'content': 'Every new iPhone or Android device that crab-walks onto U.S. shores is visually indistinct from the next. Phones have become so standard and boring that were honestly considering ultra-expensive “tri… [+4948 chars]'}",-0.043939393939393945,0.3924242424242424,"['new iphone', 'android device', 'u.s. shores', 'ultra-expensive “ tri… [ +4948 chars ]']",33,0.2571428571428571,0.2
Kotaku,Kotaku Deals,"amazon liquidates rtx 5070 gpus, asus model at new record low for early black friday","The Asus RTX 5070 delivers flagship 4K gaming at its lowest price ever. The post Amazon Liquidates RTX 5070 GPUs, Asus Model at New Record Low for Early Black Friday appeared first on Kotaku.",https://kotaku.com/amazon-liquidates-rtx-5070-gpus-asus-model-at-new-record-low-for-early-black-friday-2000640678,2025-11-03 01:39:56+00:00,your current graphics card struggles to maintain 60fps on modern aaa games and forces you to lower settings until everything looks like a playstation 3 title from 2008. the good news is that the asus… [+2314 chars],"{'source': {'id': None, 'name': 'Kotaku'}, 'author': 'Kotaku Deals', 'title': 'Amazon Liquidates RTX 5070 GPUs, Asus Model at New Record Low for Early Black Friday', 'description': 'The Asus RTX 5070 delivers flagship 4K gaming at its lowest price ever.\nThe post Amazon Liquidates RTX 5070 GPUs, Asus Model at New Record Low for Early Black Friday appeared first on Kotaku.', 'url': 'https://kotaku.com/amazon-liquidates-rtx-5070-gpus-asus-model-at-new-record-low-for-early-black-friday-2000640678', 'urlToImage': 'https://kotaku.com/app/uploads/2025/11/rtx5070-geforce.jpg', 'publishedAt': '2025-11-03T01:39:56Z', 'content': 'Your current graphics card struggles to maintain 60fps on modern AAA games and forces you to lower settings until everything looks like a PlayStation 3 title from 2008. The good news is that the Asus… [+2314 chars]'}",0.3,0.43333333333333335,"['current graphics card struggles', 'modern aaa games', 'good news', 'asus… [ +2314 chars ]']",37,0.10256410256410256,0.15384615384615385
Android Central,"techkritiko@gmail.com (Jay Bonggolto) , Jay Bonggolto",meta horizon os gets top-level firepower to combat android xr,Meta splits the Metaverse in two and puts a new boss in charge.,https://www.androidcentral.com/gaming/virtual-reality/meta-horizon-os-gets-top-level-firepower-to-combat-android-xr,2025-11-02 14:08:00+00:00,what you need to know meta is reportedly splitting its metaverse efforts into two divisions — one focused on horizon os and another on the metaverse product group — as part of a major intern… [+2671 chars],"{'source': {'id': None, 'name': 'Android Central'}, 'author': 'techkritiko@gmail.com (Jay Bonggolto) , Jay Bonggolto', 'title': 'Meta Horizon OS gets top-level firepower to combat Android XR', 'description': 'Meta splits the Metaverse in two and puts a new boss in charge.', 'url': 'https://www.androidcentral.com/gaming/virtual-reality/meta-horizon-os-gets-top-level-firepower-to-combat-android-xr', 'urlToImage': 'https://cdn.mos.cms.futurecdn.net/Gy6tBWc4LzPPznAaFTLSjC-2048-80.jpg', 'publishedAt': '2025-11-02T14:08:00Z', 'content': 'What you need to know\r\n<ul><li>Meta is reportedly splitting its metaverse efforts into two divisions — one focused on Horizon OS and another on the Metaverse Product Group — as part of a major intern… [+2671 chars]'}",0.0625,0.5,"['metaverse efforts', 'divisions —', 'horizon os', 'metaverse product group —', 'major intern… [ +2671 chars ]']",37,0.05128205128205128,0.20512820512820512
Business Insider,jsor@businessinsider.com (Jennifer Sor),4 private data points investors are watching this week for signs of economic health,Investors are watching for private updates on the job market as the government shutdown is days away from becoming the longest in history.,https://www.businessinsider.com/stock-market-this-week-layoffs-job-market-adp-manufacturing-data-2025-11,2025-11-03 16:21:11+00:00,"with no end in sight to the government shutdown, investors are still operating in the dark amid the blackout in public data. that's turning the market's attention to a handful of other updates this … [+3073 chars]","{'source': {'id': 'business-insider', 'name': 'Business Insider'}, 'author': 'jsor@businessinsider.com (Jennifer Sor)', 'title': '4 private data points investors are watching this week for signs of economic health', 'description': 'Investors are watching for private updates on the job market as the government shutdown is days away from becoming the longest in history.', 'url': 'https://www.businessinsider.com/stock-market-this-week-layoffs-job-market-adp-manufacturing-data-2025-11', 'urlToImage': 'https://i.insider.com/6908aec80be9845f2dc59200?width=1200&format=jpeg', 'publishedAt': '2025-11-03T16:21:11Z', 'content': ""With no end in sight to the government shutdown, investors are still operating in the dark amid the blackout in public data.\r\nThat's turning the market's attention to a handful of other updates this … [+3073 chars]""}",-0.09166666666666667,0.28055555555555556,"['government shutdown', 'public data', ""'s turning"", ""market 's attention"", '… [ +3073 chars ]']",39,0.04878048780487805,0.14634146341463414
Andreafortuna.org,,chat control proposal fails again after public opposition,The European Union’s controversial Chat Control proposal has been withdrawn once again following intense public pressure. This marks another defeat for legislation that would have mandated scanning of encrypted messages across the EU.,https://andreafortuna.org/2025/11/01/chat-control-proposal-fails-again-after-massive-public-opposition/,2025-11-01 16:42:57+00:00,"the european union council has once again retreated from its controversial chat control proposal, a plan that would have required widespread scanning of encrypted messages. the withdrawal by the curr… [+8862 chars]","{'source': {'id': None, 'name': 'Andreafortuna.org'}, 'author': None, 'title': 'Chat Control proposal fails again after public opposition', 'description': 'The European Union’s controversial Chat Control proposal has been withdrawn once again following intense public pressure. This marks another defeat for legislation that would have mandated scanning of encrypted messages across the EU.', 'url': 'https://andreafortuna.org/2025/11/01/chat-control-proposal-fails-again-after-massive-public-opposition/', 'urlToImage': None, 'publishedAt': '2025-11-01T16:42:57Z', 'content': 'The European Union Council has once again retreated from its controversial Chat Control proposal, a plan that would have required widespread scanning of encrypted messages. The withdrawal by the curr… [+8862 chars]'}",0.275,0.475,"['european union council', 'control proposal', 'curr… [ +8862 chars ]']",32,0.11764705882352941,0.17647058823529413
Droid Life,Tim,"oneplus gaming technology, what makes oneplus 15 so good for gaming","OnePlus is detailing why OnePlus 15 is so good for gaming on Android. It’s thanks to the newly announced OnePlus Gaming Technology, a combination of hardware, software, and optimizations made by the company. It enables things like 165fps support, HyperRenderi…",https://www.droid-life.com/2025/11/03/oneplus-gaming-technology-oneplus-15/,2025-11-03 18:52:58+00:00,"oneplus is detailing why oneplus 15 is so good for gaming on android. it’s thanks to the newly announced oneplus gaming technology, a combination of hardware, software, and optimizations made by the … [+1845 chars]","{'source': {'id': None, 'name': 'Droid Life'}, 'author': 'Tim', 'title': 'OnePlus Gaming Technology, What Makes OnePlus 15 So Good for Gaming', 'description': 'OnePlus is detailing why OnePlus 15 is so good for gaming on Android. It’s thanks to the newly announced OnePlus Gaming Technology, a combination of hardware, software, and optimizations made by the company. It enables things like 165fps support, HyperRenderi…', 'url': 'https://www.droid-life.com/2025/11/03/oneplus-gaming-technology-oneplus-15/', 'urlToImage': 'https://www.droid-life.com/wp-content/uploads/2025/09/OnePlus-15-Design-3-1200x628-cropped.jpg', 'publishedAt': '2025-11-03T18:52:58Z', 'content': 'OnePlus is detailing why OnePlus 15 is so good for gaming on Android. It’s thanks to the newly announced OnePlus Gaming Technology, a combination of hardware, software, and optimizations made by the … [+1845 chars]'}",0.3454545454545454,0.4181818181818182,"['’ s thanks', '… [ +1845 chars ]']",37,0.07692307692307693,0.2564102564102564
Hackaday,Maya Posch,reproduced and recovered: the first chinese keyboard-based mingkwai typewriter,"We all know what a typewriter looks like, and how this has been translated directly into the modern day computer keyboard, or at least many of us think we do. Many cultures do not use a writing sys…",https://hackaday.com/2025/11/03/reproduced-and-recovered-the-first-chinese-keyboard-based-mingkwai-typewriter/,2025-11-04 03:00:14+00:00,"we all know what a typewriter looks like, and how this has been translated directly into the modern day computer keyboard, or at least many of us think we do. many cultures do not use a writing syste… [+1966 chars]","{'source': {'id': None, 'name': 'Hackaday'}, 'author': 'Maya Posch', 'title': 'Reproduced and Recovered: the First Chinese Keyboard-based MingKwai Typewriter', 'description': 'We all know what a typewriter looks like, and how this has been translated directly into the modern day computer keyboard, or at least many of us think we do. Many cultures do not use a writing sys…', 'url': 'https://hackaday.com/2025/11/03/reproduced-and-recovered-the-first-chinese-keyboard-based-mingkwai-typewriter/', 'urlToImage': 'https://hackaday.com/wp-content/uploads/2025/11/mingkwai_chinese_typewriter_htx_studio_youtube.jpg', 'publishedAt': '2025-11-04T03:00:14Z', 'content': 'We all know what a typewriter looks like, and how this has been translated directly into the modern day computer keyboard, or at least many of us think we do. Many cultures do not use a writing syste… [+1966 chars]'}",0.2,0.42000000000000004,"['modern day computer keyboard', 'writing syste… [ +1966 chars ]']",40,0.09523809523809523,0.2619047619047619
Business Insider,Brent D. Griffiths,appian ceo says he refuses to use ai to screen résumés,"Appian CEO Matt Calkins said that he doesn't trust AI to do many tasks, including screening résumés.",https://www.businessinsider.com/appian-ceo-ai-resumes-companies-deployment-2025-11,2025-11-04 10:09:01+00:00,appian ceo matt calkinscourtsey of appian appian ceo matt calkins said he shut down an effort to use ai to review résumés.he said humans should be easily able to discern what makes … [+3110 chars],"{'source': {'id': 'business-insider', 'name': 'Business Insider'}, 'author': 'Brent D. Griffiths', 'title': 'Appian CEO says he refuses to use AI to screen résumés', 'description': ""Appian CEO Matt Calkins said that he doesn't trust AI to do many tasks, including screening résumés."", 'url': 'https://www.businessinsider.com/appian-ceo-ai-resumes-companies-deployment-2025-11', 'urlToImage': 'https://i.insider.com/6909260f599d46a4ccc160c6?width=1200&format=jpeg', 'publishedAt': '2025-11-04T10:09:01Z', 'content': 'Appian CEO Matt CalkinsCourtsey of Appian\r\n<ul><li>Appian CEO Matt Calkins said he shut down an effort to use AI to review résumés.</li><li>He said humans should be easily able to discern what makes … [+3110 chars]'}",0.17222222222222222,0.4569444444444445,"['appian ceo matt calkinscourtsey', 'appian appian ceo matt calkins', '… [ +3110 chars ]']",35,0.13513513513513514,0.2702702702702703
Business Insider,Shubhangi Goel,cohere's chief ai officer says ai agents come with a big security risk,"Impersonations are to AI agents what hallucinations are to large language models, says Cohere's chief AI officer.",https://www.businessinsider.com/cohere-ai-joelle-pineau-agents-impersonation-risks-security-2025-11,2025-11-04 08:55:45+00:00,cohere's chief ai officer said that impersonations are a security risk with ai agents.stephanie de sakutin for afp via getty images cohere's chief ai officer warned of security risks from ai… [+3271 chars],"{'source': {'id': 'business-insider', 'name': 'Business Insider'}, 'author': 'Shubhangi Goel', 'title': ""Cohere's chief AI officer says AI agents come with a big security risk"", 'description': ""Impersonations are to AI agents what hallucinations are to large language models, says Cohere's chief AI officer."", 'url': 'https://www.businessinsider.com/cohere-ai-joelle-pineau-agents-impersonation-risks-security-2025-11', 'urlToImage': 'https://i.insider.com/6909b80b0be9845f2dc5a527?width=1200&format=jpeg', 'publishedAt': '2025-11-04T08:55:45Z', 'content': ""Cohere's chief AI officer said that impersonations are a security risk with AI agents.Stephanie De Sakutin for AFP via Getty Images\r\n<ul><li>Cohere's chief AI officer warned of security risks from AI… [+3271 chars]""}",0.0,0.0,"[""cohere 's"", 'chief ai officer', 'security risk', 'ai agents.stephanie', ""getty images cohere 's"", 'chief ai officer', 'security risks', 'ai… [ +3271 chars ]']",35,0.21621621621621623,0.16216216216216217
Gizmodo.com,Lucas Ropek,"if you live in the uae, you can now mine bitcoin through your phone plan","Du's crypto-mining service will be available to customers via an online auction that transpires between November 3-9,",https://gizmodo.com/uae-mine-bitcoin-phone-plan-2000681113,2025-11-04 10:30:59+00:00,"despite much evidence to the contrary, many folks still feel like cryptocurrency is a net positive for the world. indeed, the digital asset industry continues to flourish in many corners of the globe… [+2302 chars]","{'source': {'id': None, 'name': 'Gizmodo.com'}, 'author': 'Lucas Ropek', 'title': 'If You Live in the UAE, You Can Now Mine Bitcoin Through Your Phone Plan', 'description': ""Du's crypto-mining service will be available to customers via an online auction that transpires between November 3-9,"", 'url': 'https://gizmodo.com/uae-mine-bitcoin-phone-plan-2000681113', 'urlToImage': 'https://gizmodo.com/app/uploads/2025/07/bitcoin-photo-1200x675.jpg', 'publishedAt': '2025-11-04T10:30:59Z', 'content': 'Despite much evidence to the contrary, many folks still feel like cryptocurrency is a net positive for the world. Indeed, the digital asset industry continues to flourish in many corners of the globe… [+2302 chars]'}",0.23787878787878788,0.2909090909090909,"['digital asset industry', 'globe… [ +2302 chars ]']",35,0.1891891891891892,0.16216216216216217
Cape Cod Times,"Rachael Devaney, Cape Cod Times",cape cod community college president on paid leave. 'ongoing personnel matter',"Cape Cod Community College President John L. Cox is on paid administrative leave as of Oct. 23, by a vote of the college Board of Trustees.",https://www.capecodtimes.com/story/news/education/campus/2025/11/02/cape-cod-community-college-john-cox-administrative-leave-paid/87009196007/,2025-11-02 10:04:30+00:00,"cape cod community college president john cox has been placed on paid administrative leave by the school, but circumstances about the move are unclear. the college board of trustees voted to place c… [+2443 chars]","{'source': {'id': None, 'name': 'Cape Cod Times'}, 'author': 'Rachael Devaney, Cape Cod Times', 'title': ""Cape Cod Community College president on paid leave. 'Ongoing personnel matter'"", 'description': 'Cape Cod Community College President John L. Cox is on paid administrative leave as of Oct. 23, by a vote of the college Board of Trustees.', 'url': 'https://www.capecodtimes.com/story/news/education/campus/2025/11/02/cape-cod-community-college-john-cox-administrative-leave-paid/87009196007/', 'urlToImage': 'https://s.yimg.com/ny/api/res/1.2/02yUO2sryhflsAJpYCqEZQ--/YXBwaWQ9aGlnaGxhbmRlcjt3PTEyMDA7aD04MDA7Y2Y9d2VicA--/https://media.zenfs.com/en/cape-cod-times/7e609ee3e2575da9b3a4fdd2454fb72f', 'publishedAt': '2025-11-02T10:04:30Z', 'content': 'Cape Cod Community College President John Cox has been placed on paid administrative leave by the school, but circumstances about the move are unclear.\r\nThe college Board of Trustees voted to place C… [+2443 chars]'}",0.0,0.0,"['cape cod community college president john cox', 'college board', 'c… [ +2443 chars ]']",35,0.08108108108108109,0.24324324324324326
