source,author,title,description,url,published_at,content,raw,sentiment_polarity,sentiment_subjectivity,noun_phrases,word_count,adj_ratio,verb_ratio
Yahoo Entertainment,Jordan Carlton,dashboard camera catches disturbing video of tailgating truck moments before it crashes into median: 'those things should be illegal',"“Couldn’t have happened to a more deserving person.""",https://www.yahoo.com/news/articles/dashboard-camera-catches-disturbing-video-154109604.html,2025-11-04 09:00:00+00:00,"a driver took to reddit to share dramatic dashcam footage after recording a pickup truck ""rolling coal"" all the way into the highway median. the video shows a pickup truck abruptly and repeatedly br… [+2521 chars]","{'source': {'id': None, 'name': 'Yahoo Entertainment'}, 'author': 'Jordan Carlton', 'title': ""Dashboard camera catches disturbing video of tailgating truck moments before it crashes into median: 'Those things should be illegal'"", 'description': '“Couldn’t have happened to a more deserving person.""', 'url': 'https://www.yahoo.com/news/articles/dashboard-camera-catches-disturbing-video-154109604.html', 'urlToImage': 'https://s.yimg.com/ny/api/res/1.2/dssr9Au4bhqJ.s3FJzqiIw--/YXBwaWQ9aGlnaGxhbmRlcjt3PTEyMDA7aD02NTY7Y2Y9d2VicA--/https://media.zenfs.com/en/the_cool_down_737/0216394bb86e293ceb1cbd9d7ed75873', 'publishedAt': '2025-11-04T09:00:00Z', 'content': 'A driver took to Reddit to share dramatic dashcam footage after recording a pickup truck ""rolling coal"" all the way into the highway median.\r\nThe video shows a pickup truck abruptly and repeatedly br… [+2521 chars]'}",-0.2791666666666667,0.8,"['dramatic dashcam footage', 'pickup truck', 'highway median', 'video shows', 'pickup truck', 'br… [ +2521 chars ]']",36,0.13157894736842105,0.15789473684210525
9to5Mac,Benjamin Mayo,apple’s new siri will secretly use google gemini models behind the scenes,"Via Mark Gurman, Apple has landed on its strategy for the new Siri update coming as soon as iOS 26.4 in the spring of next year. Behind the scenes, much of the new Siri experience will use Google Gemini models. The custom Gemini model will run on Apple’s …",https://9to5mac.com/2025/11/03/apple-iphone-new-siri-google-gemini-deal/,2025-11-03 11:24:22+00:00,"via mark gurman, apple has landed on its strategy for the new siri update coming as soon as ios 26.4 in the spring of next year. behind the scenes, much of the new siri experience will use google gem… [+2393 chars]","{'source': {'id': None, 'name': '9to5Mac'}, 'author': 'Benjamin Mayo', 'title': 'Apple’s new Siri will secretly use Google Gemini models behind the scenes', 'description': 'Via Mark Gurman, Apple has landed on its strategy for the new Siri update coming as soon as iOS 26.4 in the spring of next year. Behind the scenes, much of the new Siri experience will use Google Gemini models. \n\n\n\nThe custom Gemini model will run on Apple’s …', 'url': 'https://9to5mac.com/2025/11/03/apple-iphone-new-siri-google-gemini-deal/', 'urlToImage': 'https://i0.wp.com/9to5mac.com/wp-content/uploads/sites/6/2025/04/apple-intelligence-rainbow.jpeg?resize=1200%2C628&quality=82&strip=all&ssl=1', 'publishedAt': '2025-11-03T11:24:22Z', 'content': 'Via Mark Gurman, Apple has landed on its strategy for the new Siri update coming as soon as iOS 26.4 in the spring of next year. Behind the scenes, much of the new Siri experience will use Google Gem… [+2393 chars]'}",0.014545454545454539,0.3618181818181818,"['mark gurman', 'new siri update', 'new siri experience', 'google gem… [ +2393 chars ]']",41,0.13953488372093023,0.13953488372093023
Kotaku,Kotaku Deals,"this 1tb hp laptop at 70% off is practically free, amazon adds $299 bonus bundle on top","This HP laptop delivers MacBook-level pricing dropped to mid-range territory with premium specs. The post This 1TB HP Laptop at 70% Off Is Practically Free, Amazon Adds $299 Bonus Bundle on Top appeared first on Kotaku.",https://kotaku.com/this-1tb-hp-laptop-at-70-off-is-practically-free-amazon-adds-299-bonus-bundle-on-top-2000640664,2025-11-02 23:17:21+00:00,"a $2,000 laptop typically means you’re buying a macbook pro or high-end windows machine with premium specs that justify the investment. this hp 15.6-inch touchscreen laptop originally carried that sa… [+3345 chars]","{'source': {'id': None, 'name': 'Kotaku'}, 'author': 'Kotaku Deals', 'title': 'This 1TB HP Laptop at 70% Off Is Practically Free, Amazon Adds $299 Bonus Bundle on Top', 'description': 'This HP laptop delivers MacBook-level pricing dropped to mid-range territory with premium specs.\nThe post This 1TB HP Laptop at 70% Off Is Practically Free, Amazon Adds $299 Bonus Bundle on Top appeared first on Kotaku.', 'url': 'https://kotaku.com/this-1tb-hp-laptop-at-70-off-is-practically-free-amazon-adds-299-bonus-bundle-on-top-2000640664', 'urlToImage': 'https://kotaku.com/app/uploads/2025/11/hp-win-11-laptop.jpg', 'publishedAt': '2025-11-02T23:17:21Z', 'content': 'A $2,000 laptop typically means you’re buying a MacBook Pro or high-end Windows machine with premium specs that justify the investment. This HP 15.6-inch touchscreen laptop originally carried that sa… [+3345 chars]'}",0.10416666666666667,0.625,"['’ re buying', 'high-end windows machine', 'premium specs', 'hp 15.6-inch touchscreen laptop', 'sa… [ +3345 chars ]']",34,0.25,0.19444444444444445
Kotaku,Kotaku Deals,"dyson v11 drops to record low, amazon practically giving it away for pennies","The Dyson V11 delivers flagship vacuum performance at mid-range vacuum prices. The post Dyson V11 Drops to Record Low, Amazon Practically Giving It Away for Pennies appeared first on Kotaku.",https://kotaku.com/dyson-v11-drops-to-record-low-amazon-practically-giving-it-away-for-pennies-2000640660,2025-11-02 22:26:49+00:00,mid-range vacuum cleaners sell for around $400 and deliver middling performance that leaves you vacuuming the same spot three times. the dyson v11 cordless stick vacuum drops to $399 from $629 on ama… [+3256 chars],"{'source': {'id': None, 'name': 'Kotaku'}, 'author': 'Kotaku Deals', 'title': 'Dyson V11 Drops to Record Low, Amazon Practically Giving It Away for Pennies', 'description': 'The Dyson V11 delivers flagship vacuum performance at mid-range vacuum prices.\nThe post Dyson V11 Drops to Record Low, Amazon Practically Giving It Away for Pennies appeared first on Kotaku.', 'url': 'https://kotaku.com/dyson-v11-drops-to-record-low-amazon-practically-giving-it-away-for-pennies-2000640660', 'urlToImage': 'https://kotaku.com/app/uploads/2025/10/Dyson-V11.jpg', 'publishedAt': '2025-11-02T22:26:49Z', 'content': 'Mid-range vacuum cleaners sell for around $400 and deliver middling performance that leaves you vacuuming the same spot three times. The Dyson V11 cordless stick vacuum drops to $399 from $629 on Ama… [+3256 chars]'}",-0.005555555555555556,0.041666666666666664,"['mid-range vacuum cleaners', 'dyson v11 cordless', 'vacuum drops', 'ama… [ +3256 chars ]']",35,0.08108108108108109,0.21621621621621623
Kotaku,Kotaku Deals,"hp 17-inch laptop with ryzen 5 nearly free (71% off), amazon clearing stock for early black friday","HP 17-inch laptop with 64GB RAM drops to $1,029 and saves you $2,500 instantly. The post HP 17-Inch Laptop with Ryzen 5 Nearly Free (71% Off), Amazon Clearing Stock for Early Black Friday appeared first on Kotaku.",https://kotaku.com/hp-17-inch-laptop-with-ryzen-5-nearly-free-71-off-amazon-clearing-stock-for-early-black-friday-2000640936,2025-11-04 01:16:19+00:00,"most people can’t justify spending over $3,000 on a laptop, even if they desperately need a bigger screen for spreadsheets, video calls and multitasking across multiple windows. these premium busines… [+3053 chars]","{'source': {'id': None, 'name': 'Kotaku'}, 'author': 'Kotaku Deals', 'title': 'HP 17-Inch Laptop with Ryzen 5 Nearly Free (71% Off), Amazon Clearing Stock for Early Black Friday', 'description': 'HP 17-inch laptop with 64GB RAM drops to $1,029 and saves you $2,500 instantly.\nThe post HP 17-Inch Laptop with Ryzen 5 Nearly Free (71% Off), Amazon Clearing Stock for Early Black Friday appeared first on Kotaku.', 'url': 'https://kotaku.com/hp-17-inch-laptop-with-ryzen-5-nearly-free-71-off-amazon-clearing-stock-for-early-black-friday-2000640936', 'urlToImage': 'https://kotaku.com/app/uploads/2025/11/hp-17-laptop-ryzen.jpg', 'publishedAt': '2025-11-04T01:16:19Z', 'content': 'Most people can’t justify spending over $3,000 on a laptop, even if they desperately need a bigger screen for spreadsheets, video calls and multitasking across multiple windows. These premium busines… [+3053 chars]'}",-0.024999999999999994,0.5,"['’ t', 'video calls', 'multiple windows', 'premium busines… [ +3053 chars ]']",34,0.1388888888888889,0.16666666666666666
Kotaku,Kotaku Deals,"mac mini rival running windows hits 40% off, christmas showed up early on amazon","Desktop power in a tiny package for less than most processors cost alone. The post Mac Mini Rival Running Windows Hits 40% Off, Christmas Showed Up Early on Amazon appeared first on Kotaku.",https://kotaku.com/mac-mini-rival-running-windows-hits-40-off-christmas-showed-up-early-on-amazon-2000640785,2025-11-03 14:27:39+00:00,"apple’s mac mini gets all the attention for compact computing but plenty of people need powerful windows machines that don’t take up half a desk. developers running windows-only software, small busin… [+2859 chars]","{'source': {'id': None, 'name': 'Kotaku'}, 'author': 'Kotaku Deals', 'title': 'Mac Mini Rival Running Windows Hits 40% Off, Christmas Showed Up Early on Amazon', 'description': 'Desktop power in a tiny package for less than most processors cost alone.\nThe post Mac Mini Rival Running Windows Hits 40% Off, Christmas Showed Up Early on Amazon appeared first on Kotaku.', 'url': 'https://kotaku.com/mac-mini-rival-running-windows-hits-40-off-christmas-showed-up-early-on-amazon-2000640785', 'urlToImage': 'https://kotaku.com/app/uploads/2025/09/GMKtec-Mini-PC-Intel-Core-i7-1195G7-1200x675.jpg', 'publishedAt': '2025-11-03T14:27:39Z', 'content': 'Apple’s Mac Mini gets all the attention for compact computing but plenty of people need powerful Windows machines that don’t take up half a desk. Developers running Windows-only software, small busin… [+2859 chars]'}",-0.03888888888888889,0.5222222222222223,"['apple ’ s mac mini', 'people need', 'powerful windows machines', 'don ’ t', 'small busin… [ +2859 chars ]']",37,0.10256410256410256,0.1794871794871795
How-To Geek,Tyler Dupont,skip the tesla - this used luxury ev is the smarter buy,"For the price of a new Model 3, you can get this used luxury EV instead.",https://www.howtogeek.com/skip-tesla-this-used-luxury-ev-smarter-buy/,2025-11-03 19:30:17+00:00,"if youre considering a luxury electric vehicle, but feel put off by the hype and premium price of the typical go-to brand, its time to look elsewhere. one used luxury ev now stands out as a smarter b… [+7763 chars]","{'source': {'id': None, 'name': 'How-To Geek'}, 'author': 'Tyler Dupont', 'title': 'Skip the Tesla - This used luxury EV is the smarter buy', 'description': 'For the price of a new Model 3, you can get this used luxury EV instead.', 'url': 'https://www.howtogeek.com/skip-tesla-this-used-luxury-ev-smarter-buy/', 'urlToImage': 'https://s.yimg.com/ny/api/res/1.2/uOjh4DdkgyjXiQa4hV11IA--/YXBwaWQ9aGlnaGxhbmRlcjt3PTEyMDA7aD02NzU-/https://media.zenfs.com/en/how_to_geek_999/9a20138fee627630a9252641763baedb', 'publishedAt': '2025-11-03T19:30:17Z', 'content': 'If youre considering a luxury electric vehicle, but feel put off by the hype and premium price of the typical go-to brand, its time to look elsewhere. One used luxury EV now stands out as a smarter b… [+7763 chars]'}",-0.16666666666666666,0.5,"['electric vehicle', 'premium price', 'typical go-to brand', 'luxury ev', 'smarter b… [ +7763 chars ]']",40,0.11904761904761904,0.16666666666666666
Wikihow.com,Tami Claytor,"professional ways to say ""please let me know if you need anything""",Show your support with this polite email phraseYou’ve probably come across the phrase “Please let me know if you need anything” in emails with coworkers or colleagues. Many people use this polite and professional phrase to convey their ongoing support. It's a…,https://www.wikihow.com/Please-Let-Me-Know-if-You-Need-Anything,2025-11-04 08:00:00+00:00,"this article was reviewed by tami claytor and by wikihow staff writer, annabelle reyes. tami claytor is an etiquette coach, image consultant, and the owner of always appropriate image and etiquette c… [+785 chars]","{'source': {'id': None, 'name': 'Wikihow.com'}, 'author': 'Tami Claytor', 'title': 'Professional Ways to Say ""Please Let Me Know if You Need Anything""', 'description': ""Show your support with this polite email phraseYou’ve probably come across the phrase “Please let me know if you need anything” in emails with coworkers or colleagues. Many people use this polite and professional phrase to convey their ongoing support. It's a…"", 'url': 'https://www.wikihow.com/Please-Let-Me-Know-if-You-Need-Anything', 'urlToImage': 'https://www.wikihow.com/images/2/20/Please-Let-Me-Know-if-You-Need-Anything-Step-9.jpg', 'publishedAt': '2025-11-04T08:00:00Z', 'content': 'This article was reviewed by Tami Claytor and by wikiHow staff writer, Annabelle Reyes. Tami Claytor is an Etiquette Coach, Image Consultant, and the Owner of Always Appropriate Image and Etiquette C… [+785 chars]'}",0.5,0.5,"['tami claytor', 'wikihow staff writer', 'annabelle reyes', 'tami claytor', 'etiquette coach', 'image consultant', 'appropriate image', 'etiquette c… [ +785 chars ]']",34,0.1111111111111111,0.1388888888888889
Gizmodo.com,Ellyn Lapointe,elon musk wants to block out the sun,The CEO of the largest satellite company in the world just proposed a bold—and totally misguided—solution to the climate crisis.,https://gizmodo.com/elon-musk-wants-to-block-out-the-sun-2000680770,2025-11-03 17:25:20+00:00,"earths average temperature is nearing critical thresholds as the international community lags behind its emissions goals. as a result, bold technological strategies to cool the planet have gained att… [+3934 chars]","{'source': {'id': None, 'name': 'Gizmodo.com'}, 'author': 'Ellyn Lapointe', 'title': 'Elon Musk Wants to Block Out the Sun', 'description': 'The CEO of the largest satellite company in the world just proposed a bold—and totally misguided—solution to the climate crisis.', 'url': 'https://gizmodo.com/elon-musk-wants-to-block-out-the-sun-2000680770', 'urlToImage': 'https://gizmodo.com/app/uploads/2025/11/Earth-and-Sun-1200x675.jpg', 'publishedAt': '2025-11-03T17:25:20Z', 'content': 'Earths average temperature is nearing critical thresholds as the international community lags behind its emissions goals. As a result, bold technological strategies to cool the planet have gained att… [+3934 chars]'}",0.02222222222222221,0.5361111111111111,"['earths average temperature', 'critical thresholds', 'international community lags', 'emissions goals', 'bold technological strategies', 'att… [ +3934 chars ]']",31,0.21212121212121213,0.21212121212121213
iLounge,Samantha Wiley,safari technology preview 231 released by apple,"A new update for Safari Technology Preview has been released by Apple. The browser was introduced as a test browser back in 2016, which lets users test features that will be released in future updates for the Safari Browser. Preview 231 for Safari Technology …",https://www.ilounge.com/news/apple/safari-technology-preview-231-released-by-apple,2025-11-02 17:16:10+00:00,"a new update for safari technology preview has been released by apple. the browser was introduced as a test browser back in 2016, which lets users test features that will be released in future update… [+763 chars]","{'source': {'id': None, 'name': 'iLounge'}, 'author': 'Samantha Wiley', 'title': 'Safari Technology Preview 231 Released By Apple', 'description': 'A new update for Safari Technology Preview has been released by Apple. The browser was introduced as a test browser back in 2016, which lets users test features that will be released in future updates for the Safari Browser. Preview 231 for Safari Technology …', 'url': 'https://www.ilounge.com/news/apple/safari-technology-preview-231-released-by-apple', 'urlToImage': 'https://www.ilounge.com/wp-content/uploads/2025/11/Safari-Technology-Preview-Updated-Feature-1.jpg', 'publishedAt': '2025-11-02T17:16:10Z', 'content': 'A new update for Safari Technology Preview has been released by Apple. The browser was introduced as a test browser back in 2016, which lets users test features that will be released in future update… [+763 chars]'}",0.04545454545454545,0.1931818181818182,"['new update', 'safari technology preview', 'test browser', 'lets users test', 'future update… [ +763 chars ]']",37,0.10256410256410256,0.28205128205128205
Nakedcapitalism.com,Yves Smith,technology empires and the race to cement dominance,"A look at how the US and China are seeking to achieve technology hegemonies, and the efforts of smaller countries to carve out niches.",https://www.nakedcapitalism.com/2025/11/technology-empires-and-the-race-to-cement-dominance.html,2025-11-04 09:02:45+00:00,yves here. john ruehl’s generally informative piece on how the us and china are seeking to secure their technology spheres of influence is marred by at least one historical inaccuracy. ruehl asserts … [+14370 chars],"{'source': {'id': None, 'name': 'Nakedcapitalism.com'}, 'author': 'Yves Smith', 'title': 'Technology Empires and the Race to Cement Dominance', 'description': 'A look at how the US and China are seeking to achieve technology hegemonies, and the efforts of smaller countries to carve out niches.', 'url': 'https://www.nakedcapitalism.com/2025/11/technology-empires-and-the-race-to-cement-dominance.html', 'urlToImage': None, 'publishedAt': '2025-11-04T09:02:45Z', 'content': 'Yves here. John Ruehl’s generally informative piece on how the US and China are seeking to secure their technology spheres of influence is marred by at least one historical inaccuracy. Ruehl asserts … [+14370 chars]'}",0.03750000000000002,0.375,"['john ruehl ’ s', 'informative piece', 'technology spheres', 'historical inaccuracy', 'ruehl asserts … [ +14370 chars ]']",37,0.07692307692307693,0.23076923076923078
Theregister.com,Lindsay Clark,"agentic ai reshaping tech hiring policies, say ctos and cios","Oh the irony: IEEE survey of senior techies finds demand for devs skills falling in AI-related roles Demand for software development skills in AI-related roles is set to fall next year as agentic AI accelerates across business markets, according to an IEEE in…",https://www.theregister.com/2025/11/03/demand_for_software_skills_ai_jobs/,2025-11-03 13:19:42+00:00,"demand for software development skills in ai-related roles is set to fall next year as agentic ai accelerates across business markets, according to an ieee industry survey. or so says research by th… [+2423 chars]","{'source': {'id': None, 'name': 'Theregister.com'}, 'author': 'Lindsay Clark', 'title': 'Agentic AI reshaping tech hiring policies, say CTOs and CIOs', 'description': 'Oh the irony: IEEE survey of senior techies finds demand for devs skills falling in AI-related roles\nDemand for software development skills in AI-related roles is set to fall next year as agentic AI accelerates across business markets, according to an IEEE in…', 'url': 'https://www.theregister.com/2025/11/03/demand_for_software_skills_ai_jobs/', 'urlToImage': 'https://regmedia.co.uk/2017/07/20/conveyorbeltrobots.jpg', 'publishedAt': '2025-11-03T13:19:42Z', 'content': 'Demand for software development skills in AI-related roles is set to fall next year as agentic AI accelerates across business markets, according to an IEEE industry survey.\r\nOr so says research by th… [+2423 chars]'}",0.0,0.0,"['software development skills', 'agentic ai accelerates', 'business markets', 'ieee industry survey', 'th… [ +2423 chars ]']",35,0.08108108108108109,0.21621621621621623
Yahoo Entertainment,Kim LaCapria,researchers make disturbing discovery lingering deep within earth's oceans: 'relatively under-investigated',"""Has likely led to an underestimation of their ... impact.""",https://www.yahoo.com/news/articles/researchers-disturbing-discovery-lingering-deep-235500250.html,2025-11-02 23:55:00+00:00,"plastic pollution, and microplastics in particular, are a major concern affecting the ocean, and a new study identified a potentially underestimated source of this form of marine contamination. what… [+3227 chars]","{'source': {'id': None, 'name': 'Yahoo Entertainment'}, 'author': 'Kim LaCapria', 'title': ""Researchers make disturbing discovery lingering deep within Earth's oceans: 'Relatively under-investigated'"", 'description': '""Has likely led to an underestimation of their ... impact.""', 'url': 'https://www.yahoo.com/news/articles/researchers-disturbing-discovery-lingering-deep-235500250.html', 'urlToImage': 'https://s.yimg.com/ny/api/res/1.2/4I1WcEraltKHewUB2A1wiA--/YXBwaWQ9aGlnaGxhbmRlcjt3PTEyMDA7aD02ODE7Y2Y9d2VicA--/https://media.zenfs.com/en/the_cool_down_737/d116d95ee90391b0b7352db3af5928c3', 'publishedAt': '2025-11-02T23:55:00Z', 'content': 'Plastic pollution, and microplastics in particular, are a major concern affecting the ocean, and a new study identified a potentially underestimated source of this form of marine contamination.\r\nWhat… [+3227 chars]'}",0.09138257575757575,0.571969696969697,"['plastic pollution', 'major concern', 'new study', 'marine contamination', 'what… [ +3227 chars ]']",31,0.15151515151515152,0.15151515151515152
Yahoo Entertainment,Bloomberg News,china urges us to avoid ‘red lines’ after reaching trade truce,"Ambassador to the US Xie Feng named Taiwan, democracy and human rights, China’s political system, and development rights as Beijing’s four red lines, adding ...",https://finance.yahoo.com/news/china-urges-us-avoid-red-011216502.html,2025-11-04 01:12:16+00:00,"(bloomberg) -- china called on the us to avoid four sensitive issues so a trade truce sealed between presidents donald trump and xi jinping can hold, highlighting the broad array of disagreements tha… [+3160 chars]","{'source': {'id': None, 'name': 'Yahoo Entertainment'}, 'author': 'Bloomberg News', 'title': 'China Urges US to Avoid ‘Red Lines’ After Reaching Trade Truce', 'description': 'Ambassador to the US Xie Feng named Taiwan, democracy and human rights, China’s political system, and development rights as Beijing’s four red lines, adding ...', 'url': 'https://finance.yahoo.com/news/china-urges-us-avoid-red-011216502.html', 'urlToImage': 'https://s.yimg.com/ny/api/res/1.2/Ku08hcP9ikZDi8lNMFEaAg--/YXBwaWQ9aGlnaGxhbmRlcjt3PTEyMDA7aD04MDA-/https://media.zenfs.com/en/bloomberg_holding_pen_162/c9dba53919dd606393d489059155289d', 'publishedAt': '2025-11-04T01:12:16Z', 'content': '(Bloomberg) -- China called on the US to avoid four sensitive issues so a trade truce sealed between Presidents Donald Trump and Xi Jinping can hold, highlighting the broad array of disagreements tha… [+3160 chars]'}",0.08125,0.60625,"['sensitive issues', 'trade truce', 'presidents donald trump', 'broad array', 'disagreements tha… [ +3160 chars ]']",34,0.1388888888888889,0.19444444444444445
Yahoo Entertainment,Brittany Davies,eye-opening study reveals the home appliance that spews more benzene than secondhand smoke: 'you're at an elevated risk [of cancer]',The research showed indoor concentrations well above recommended health benchmarks.,https://www.yahoo.com/news/articles/study-reveals-home-appliance-spews-110000657.html,2025-11-02 10:00:00+00:00,"a study found that gas-powered appliances can increase the levels of the chemical benzene, a known cancer-causing agent found in cigarette smoke, inside the home. according to the stanford-led study… [+3157 chars]","{'source': {'id': None, 'name': 'Yahoo Entertainment'}, 'author': 'Brittany Davies', 'title': ""Eye-opening study reveals the home appliance that spews more benzene than secondhand smoke: 'You're at an elevated risk [of cancer]'"", 'description': 'The research showed indoor concentrations well above recommended health benchmarks.', 'url': 'https://www.yahoo.com/news/articles/study-reveals-home-appliance-spews-110000657.html', 'urlToImage': 'https://s.yimg.com/ny/api/res/1.2/iCN8oXLYz2zI1RxsdDYUwQ--/YXBwaWQ9aGlnaGxhbmRlcjt3PTEyMDA7aD04MDA7Y2Y9d2VicA--/https://media.zenfs.com/en/the_cool_down_737/47a5c3a8204d5c6f24fe1729304932d3', 'publishedAt': '2025-11-02T10:00:00Z', 'content': 'A study found that gas-powered appliances can increase the levels of the chemical benzene, a known cancer-causing agent found in cigarette smoke, inside the home.\r\nAccording to the Stanford-led study… [+3157 chars]'}",0.0,0.0,"['chemical benzene', 'cigarette smoke', 'study… [ +3157 chars ]']",32,0.058823529411764705,0.20588235294117646
