source,author,title,description,url,published_at,content,raw,sentiment_polarity,sentiment_subjectivity,noun_phrases,word_count,adj_ratio,verb_ratio
Wired,Javier Carbajal,a new light-based cancer treatment kills tumor cells and spares healthy ones,"By combining LED technology and nanomaterials, researchers have created a therapy that eliminates cancer cells using localized heat without damaging healthy tissue.",https://www.wired.com/story/a-new-light-based-cancer-treatment-kills-tumor-cells-and-spares-healthy-ones/,2025-11-04 09:30:00+00:00,"in the fight against cancer, an important field of research is the search for safe alternatives to chemotherapy and radiotherapy. these treatments attack both cancer cells and healthy cells, exposing… [+2662 chars]","{'source': {'id': 'wired', 'name': 'Wired'}, 'author': 'Javier Carbajal', 'title': 'A New Light-Based Cancer Treatment Kills Tumor Cells and Spares Healthy Ones', 'description': 'By combining LED technology and nanomaterials, researchers have created a therapy that eliminates cancer cells using localized heat without damaging healthy tissue.', 'url': 'https://www.wired.com/story/a-new-light-based-cancer-treatment-kills-tumor-cells-and-spares-healthy-ones/', 'urlToImage': 'https://media.wired.com/photos/6908870efd0308d4d7712bfc/191:100/w_1280,c_limit/ScienceSourceImages_1528308_HighRes.jpg', 'publishedAt': '2025-11-04T09:30:00Z', 'content': 'In the fight against cancer, an important field of research is the search for safe alternatives to chemotherapy and radiotherapy. These treatments attack both cancer cells and healthy cells, exposing… [+2662 chars]'}",0.4666666666666666,0.6666666666666666,"['important field', 'safe alternatives', 'treatments attack', 'cancer cells', 'healthy cells', 'exposing… [ +2662 chars ]']",32,0.08823529411764706,0.14705882352941177
The Verge,Andrew J. Hawkins,"‘eyes-off driving’ is coming, and we’re so not ready","Last month, General Motors added its name to the growing list of automakers who are pursuing a novel type of partially automated technology called ""eyes-off driving."" What they didn't do, though, is provide a thorough description of how they'll take responsib…",https://www.theverge.com/transportation/812439/eyes-off-driving-level-3-legal-liability-crash,2025-11-03 21:34:45+00:00,level 3 automation is coming faster than we think. who will be liable when these systems inevitably make a mistake? level 3 automation is coming faster than we … [+9143 chars],"{'source': {'id': 'the-verge', 'name': 'The Verge'}, 'author': 'Andrew J. Hawkins', 'title': '‘Eyes-off driving’ is coming, and we’re so not ready', 'description': 'Last month, General Motors added its name to the growing list of automakers who are pursuing a novel type of partially automated technology called ""eyes-off driving."" What they didn\'t do, though, is provide a thorough description of how they\'ll take responsib…', 'url': 'https://www.theverge.com/transportation/812439/eyes-off-driving-level-3-legal-liability-crash', 'urlToImage': 'https://platform.theverge.com/wp-content/uploads/sites/2/2025/11/MYXX_Cadillac_IQL_Level3_CA_12844.jpg?quality=90&strip=all&crop=0%2C3.4613147178592%2C100%2C93.077370564282&w=1200', 'publishedAt': '2025-11-03T21:34:45Z', 'content': '<ul><li></li><li></li><li></li></ul>\r\nLevel 3 automation is coming faster than we think. Who will be liable when these systems inevitably make a mistake?\r\nLevel 3 automation is coming faster than we … [+9143 chars]'}",-0.05,0.75,['… [ +9143 chars ]'],31,0.06060606060606061,0.2727272727272727
Wired,Nena Farrell,aura ink review (2025): newspaper-style realism,Aura's new digital photo frame changes the game with a fully wireless device and E Ink screen.,https://www.wired.com/review/aura-ink/,2025-11-02 12:31:00+00:00,"the digital photo frame landscape has looked pretty much the same for the past few years. the best ones come from a few brands, and while new models have come out, the designs have usually focused on… [+1642 chars]","{'source': {'id': 'wired', 'name': 'Wired'}, 'author': 'Nena Farrell', 'title': 'Aura Ink Review (2025): Newspaper-Style Realism', 'description': ""Aura's new digital photo frame changes the game with a fully wireless device and E Ink screen."", 'url': 'https://www.wired.com/review/aura-ink/', 'urlToImage': 'https://media.wired.com/photos/690677bd96b50a938bcf8883/191:100/w_1280,c_limit/Aura-Ink-Front-Wall%202%20source%20Aura.png', 'publishedAt': '2025-11-02T12:31:00Z', 'content': 'The digital photo frame landscape has looked pretty much the same for the past few years. The best ones come from a few brands, and while new models have come out, the designs have usually focused on… [+1642 chars]'}",0.06863636363636363,0.27795454545454545,"['digital photo frame landscape', 'new models', 'on… [ +1642 chars ]']",39,0.21951219512195122,0.21951219512195122
Business Insider,Lloyd Lee,3 ceos on the frontlines of driverless tech challenged my assumptions on autonomy,Three CEOs working on autonomy dispel some of the common misconceptions around driverless technology.,https://www.businessinsider.com/ceos-on-autonomy-robotaxis-self-driving-nuro-kodiak-waabi-2025-11,2025-11-02 08:21:01+00:00,"don burnette, raquel urtasun, and dave ferguson are ceos and founders who have collectively spent close to five decades working on driverless technology.getty images; kodiak; jenny morgan do… [+6676 chars]","{'source': {'id': 'business-insider', 'name': 'Business Insider'}, 'author': 'Lloyd Lee', 'title': '3 CEOs on the frontlines of driverless tech challenged my assumptions on autonomy', 'description': 'Three CEOs working on autonomy dispel some of the common misconceptions around driverless technology.', 'url': 'https://www.businessinsider.com/ceos-on-autonomy-robotaxis-self-driving-nuro-kodiak-waabi-2025-11', 'urlToImage': 'https://i.insider.com/69068492599d46a4ccc14cbe?width=1200&format=jpeg', 'publishedAt': '2025-11-02T08:21:01Z', 'content': 'Don Burnette, Raquel Urtasun, and Dave Ferguson are CEOs and founders who have collectively spent close to five decades working on driverless technology.Getty Images; Kodiak; Jenny Morgan\r\n<ul><li>Do… [+6676 chars]'}",-0.1,0.1,"['don burnette', 'raquel urtasun', 'dave ferguson', 'driverless technology.getty images', 'jenny morgan do… [ +6676 chars ]']",30,0.09375,0.25
CNET,Tyler Lacoma,the ultimate pet tech roundup: cnet’s pet owners tested every device to find the best,"From cameras and feeding stations to litterboxes and trackers, CNET dove into every kind of pet technology to find what’s worth your money and time.",https://www.cnet.com/home/smart-home/the-ultimate-pet-tech-roundup-cnets-pet-owners-tested-devices-to-find-the-best/,2025-11-03 11:00:00+00:00,"why i like it: as someone who has had pets their whole life, i’m constantly trying to make caring for them convenient. i’ve tried multiple automatic feeders over the years, but all were for dry foo… [+2356 chars]","{'source': {'id': None, 'name': 'CNET'}, 'author': 'Tyler Lacoma', 'title': 'The Ultimate Pet Tech Roundup: CNET’s Pet Owners Tested Every Device to Find the Best', 'description': 'From cameras and feeding stations to litterboxes and trackers, CNET dove into every kind of pet technology to find what’s worth your money and time.', 'url': 'https://www.cnet.com/home/smart-home/the-ultimate-pet-tech-roundup-cnets-pet-owners-tested-devices-to-find-the-best/', 'urlToImage': 'https://www.cnet.com/a/img/resize/b51b4d8531e36283e25f01e1c436bd251f9c89ea/hub/2025/10/28/a991ba6b-c65d-4b38-a71c-a67dcc6de077/fi-collar-pet-tech-main.jpg?auto=webp&fit=crop&height=675&width=1200', 'publishedAt': '2025-11-03T11:00:00Z', 'content': 'Why I like it: \r\nAs someone who has had pets their whole life, I’m constantly trying to make caring for them convenient. I’ve tried multiple automatic feeders over the years, but all were for dry foo… [+2356 chars]'}",0.03333333333333334,0.33333333333333337,"['whole life', 'i ’ m', 'i ’ ve', 'multiple automatic feeders', 'dry foo… [ +2356 chars ]']",42,0.11363636363636363,0.25
Yahoo Entertainment,Bloomberg,new deals show ai compute spend keeps growing,T. Rowe Price's Science & Technology Fund Portfolio Manager Tony Wang discusses the impact of the latest deals and demand for AI compute. He joins Caroline...,https://finance.yahoo.com/video/deals-show-ai-compute-spend-201404375.html,2025-11-03 20:14:04+00:00,"oops, something went wrong","{'source': {'id': None, 'name': 'Yahoo Entertainment'}, 'author': 'Bloomberg', 'title': 'New Deals Show AI Compute Spend Keeps Growing', 'description': ""T. Rowe Price's Science & Technology Fund Portfolio Manager Tony Wang discusses the impact of the latest deals and demand for AI compute. He joins Caroline..."", 'url': 'https://finance.yahoo.com/video/deals-show-ai-compute-spend-201404375.html', 'urlToImage': 'https://s.yimg.com/ny/api/res/1.2/mkN5Z1CIREN1Q49X5AC9_Q--/YXBwaWQ9aGlnaGxhbmRlcjt3PTEyMDA7aD02NzU-/https://media.zenfs.com/en/bloomberg_markets_video_2/b4f92894c4b5c362c11b749b76e5c24f', 'publishedAt': '2025-11-03T20:14:04Z', 'content': 'Oops, something went wrong'}",-0.5,0.9,[],4,0.25,0.25
Gizmodo.com,Gayoung Lee,aliens might not do physics like we do—and that’s a problem,Daniel Whiteson and Andy Warner’s upcoming book is a philosophical exploration of the humanity behind our desire to find aliens.,https://gizmodo.com/aliens-might-not-do-physics-like-we-do-and-thats-a-problem-2000679701,2025-11-02 11:00:56+00:00,"at gizmodo, we love a good story about aliensespecially if it gives us a headache. personally, i reward extra points for bonus dad jokes. daniel whiteson and andy warners upcoming book, do aliens sp… [+9119 chars]","{'source': {'id': None, 'name': 'Gizmodo.com'}, 'author': 'Gayoung Lee', 'title': 'Aliens Might Not Do Physics Like We Do—and That’s a Problem', 'description': 'Daniel Whiteson and Andy Warner’s upcoming book is a philosophical exploration of the humanity behind our desire to find aliens.', 'url': 'https://gizmodo.com/aliens-might-not-do-physics-like-we-do-and-thats-a-problem-2000679701', 'urlToImage': 'https://gizmodo.com/app/uploads/2025/10/aliens-speak-physics-main-e1761853955565-1200x675.jpg', 'publishedAt': '2025-11-02T11:00:56Z', 'content': 'At Gizmodo, we love a good story about aliensespecially if it gives us a headache. Personally, I reward extra points for bonus dad jokes.\r\nDaniel Whiteson and Andy Warners upcoming book, Do Aliens Sp… [+9119 chars]'}",0.3,0.4000000000000001,"['good story', 'i reward', 'extra points', 'bonus dad jokes', 'daniel whiteson', 'andy warners', 'aliens sp… [ +9119 chars ]']",36,0.10526315789473684,0.21052631578947367
ABC News,Mark Guarino,ai chatbot dangers: are there enough guardrails to protect children?,"Last week, Character.AI, one of the leading platforms for AI technology, announced it was banning anyone under 18 from having conversations with its chatbots.",https://abcnews.go.com/Technology/chatbot-dangers-guardrails-protect-children-vulnerable-people/story?id=127099944,2025-11-03 00:58:01+00:00,"character.ai, one of the leading platforms for ai technology, recently announced it was banning anyone under 18 from having conversations with its chatbots. the decision represents a bold step forwar… [+3898 chars]","{'source': {'id': 'abc-news', 'name': 'ABC News'}, 'author': 'Mark Guarino', 'title': 'AI chatbot dangers: Are there enough guardrails to protect children?', 'description': 'Last week, Character.AI, one of the leading platforms for AI technology, announced it was banning anyone under 18 from having conversations with its chatbots.', 'url': 'https://abcnews.go.com/Technology/chatbot-dangers-guardrails-protect-children-vulnerable-people/story?id=127099944', 'urlToImage': 'https://i.abcnewsfe.com/a/175d98b9-4bac-410e-8c67-5a2303cf0fbf/AI_1762129950338_hpMain_16x9.jpg?w=1600', 'publishedAt': '2025-11-03T00:58:01Z', 'content': 'Character.AI, one of the leading platforms for AI technology, recently announced it was banning anyone under 18 from having conversations with its chatbots. The decision represents a bold step forwar… [+3898 chars]'}",0.16666666666666666,0.4583333333333333,"['ai technology', 'bold step forwar… [ +3898 chars ]']",32,0.058823529411764705,0.23529411764705882
The Verge,Jess Weatherbed,coca-cola’s new ai holiday ad is a sloppy eyesore,"Coca-Cola is once again using generative AI to reimagine its classic Coke caravan holiday commercials, and in doing so, killing some of the festive joy you have for the brand. After receiving backlash for airing three AI-generated holiday commercials last yea…",https://www.theverge.com/news/812559/coca-cola-ai-holiday-christmas-commercial-2025,2025-11-03 17:31:51+00:00,the holidays are coming to cheapen your seasonal nostalgia. the holidays are coming to cheapen your seasonal nostalgia. by jess weatherbedclose jess weatherb… [+3741 chars],"{'source': {'id': 'the-verge', 'name': 'The Verge'}, 'author': 'Jess Weatherbed', 'title': 'Coca-Cola’s new AI holiday ad is a sloppy eyesore', 'description': 'Coca-Cola is once again using generative AI to reimagine its classic Coke caravan holiday commercials, and in doing so, killing some of the festive joy you have for the brand. After receiving backlash for airing three AI-generated holiday commercials last yea…', 'url': 'https://www.theverge.com/news/812559/coca-cola-ai-holiday-christmas-commercial-2025', 'urlToImage': 'https://platform.theverge.com/wp-content/uploads/sites/2/2025/11/Coca-Cola-AI-holiday-ad-2025.png?quality=90&strip=all&crop=0%2C10.732984293194%2C100%2C78.534031413613&w=1200', 'publishedAt': '2025-11-03T17:31:51Z', 'content': '<ul><li></li><li></li><li></li></ul>\r\nThe Holidays Are Coming to cheapen your seasonal nostalgia.\r\nThe Holidays Are Coming to cheapen your seasonal nostalgia.\r\nby\r\nJess WeatherbedClose\r\nJess Weatherb… [+3741 chars]'}",0.0,0.0,"['seasonal nostalgia', 'seasonal nostalgia', 'jess weatherbedclose jess weatherb… [ +3741 chars ]']",25,0.1111111111111111,0.2962962962962963
Android Central,"techkritiko@gmail.com (Jay Bonggolto) , Jay Bonggolto","your next android phone could get unmatched speed, but it comes at a price",Qualcomm’s Snapdragon 8 Elite Gen 6 promises a major power and efficiency leap for Android phones.,https://www.androidcentral.com/phones/qualcomm/your-next-android-phone-could-get-unmatched-speed-but-it-comes-at-a-price,2025-11-01 15:48:17+00:00,"what you need to know qualcomm could allegedly skip the traditional 2nm process for tsmc's advanced n2p, enhancing performance and reducing power consumption.snapdragon 8 elite gen … [+2613 chars]","{'source': {'id': None, 'name': 'Android Central'}, 'author': 'techkritiko@gmail.com (Jay Bonggolto) , Jay Bonggolto', 'title': 'Your next Android phone could get unmatched speed, but it comes at a price', 'description': 'Qualcomm’s Snapdragon 8 Elite Gen 6 promises a major power and efficiency leap for Android phones.', 'url': 'https://www.androidcentral.com/phones/qualcomm/your-next-android-phone-could-get-unmatched-speed-but-it-comes-at-a-price', 'urlToImage': 'https://cdn.mos.cms.futurecdn.net/rcJq6g3FrXH6vabXiVUcvD-2560-80.jpg', 'publishedAt': '2025-11-01T15:48:17Z', 'content': ""What you need to know\r\n<ul><li>Qualcomm could allegedly skip the traditional 2nm process for TSMC's advanced N2P, enhancing performance and reducing power consumption.</li><li>Snapdragon 8 Elite Gen … [+2613 chars]""}",0.10000000000000002,0.48333333333333334,"['traditional 2nm process', ""tsmc 's"", 'power consumption.snapdragon', 'elite gen … [ +2613 chars ]']",30,0.09375,0.21875
BBC News,,stone tool discovery suggests very first humans were inventors,The find shows that the technology was passed down through thousands of generations.,https://www.bbc.com/news/articles/ce8zn4ln85ro,2025-11-04 10:01:47+00:00,"they look like simple stones, but they were state of the art tools millions of years ago, made with great skill and precison the very first humans millions of years ago may have been inventors, acco… [+5365 chars]","{'source': {'id': None, 'name': 'BBC News'}, 'author': None, 'title': 'Stone tool discovery suggests very first humans were inventors', 'description': 'The find shows that the technology was passed down through thousands of generations.', 'url': 'https://www.bbc.com/news/articles/ce8zn4ln85ro', 'urlToImage': 'https://ichef.bbci.co.uk/news/1024/branded_news/caa9/live/38cb21b0-b8c5-11f0-ba75-093eca1ac29b.jpg', 'publishedAt': '2025-11-04T10:01:47Z', 'content': 'They look like simple stones, but they were state of the art tools millions of years ago, made with great skill and precison\r\nThe very first humans millions of years ago may have been inventors, acco… [+5365 chars]'}",0.375,0.5134920634920636,"['simple stones', 'art tools millions', 'great skill', 'humans millions', 'acco… [ +5365 chars ]']",38,0.1,0.2
BBC News,,firms ordered to reduce forever chemicals in drinking water for 6m people,The persistent pollutants which build up in the environment have been linked to serious illnesses.,https://www.bbc.com/news/articles/c9q1nzyzyjeo,2025-11-03 00:32:19+00:00,"esme stallard,climate and science reporter, bbc news and becky dale and wesley stephenson,senior data journalists, bbc verify water companies have been ordered to tackle potentially harmful levels… [+6141 chars]","{'source': {'id': None, 'name': 'BBC News'}, 'author': None, 'title': 'Firms ordered to reduce forever chemicals in drinking water for 6m people', 'description': 'The persistent pollutants which build up in the environment have been linked to serious illnesses.', 'url': 'https://www.bbc.com/news/articles/c9q1nzyzyjeo', 'urlToImage': 'https://ichef.bbci.co.uk/news/1024/branded_news/9d4a/live/a59b8a20-b648-11f0-b537-0b1fa31d0c29.jpg', 'publishedAt': '2025-11-03T00:32:19Z', 'content': 'Esme Stallard,Climate and science reporter, BBC News and \r\nBecky Dale and Wesley Stephenson,Senior data journalists, BBC Verify\r\nWater companies have been ordered to tackle potentially harmful levels… [+6141 chars]'}",0.0,1.0,"['esme stallard', 'science reporter', 'bbc news', 'becky dale', 'wesley stephenson', 'senior data journalists', 'water companies', 'harmful levels… [ +6141 chars ]']",31,0.18181818181818182,0.18181818181818182
Gizmodo.com,Mike Pearl,chatgpt’s browser bot seems to avoid new york times links like a rat who got electrocuted,"Atlas appears to have journeyed far from litigious publications, favoring a safer, more AI-friendly path to the end of its little rat maze.",https://gizmodo.com/chatgpts-browser-bot-seems-to-avoid-new-york-times-links-like-a-rat-who-got-electrocuted-2000680444,2025-11-02 22:49:40+00:00,"ai-powered browsers like chatgpt atlas aren’t just browsers with little chatgpt picture-in-picture boxes off to the side answering questions. they also have “agentic capabilities,” meaning they can t… [+2821 chars]","{'source': {'id': None, 'name': 'Gizmodo.com'}, 'author': 'Mike Pearl', 'title': 'ChatGPT’s Browser Bot Seems to Avoid New York Times Links Like a Rat Who Got Electrocuted', 'description': 'Atlas appears to have journeyed far from litigious publications, favoring a safer, more AI-friendly path to the end of its little rat maze.', 'url': 'https://gizmodo.com/chatgpts-browser-bot-seems-to-avoid-new-york-times-links-like-a-rat-who-got-electrocuted-2000680444', 'urlToImage': 'https://gizmodo.com/app/uploads/2025/11/rat-maze-1200x675.jpg', 'publishedAt': '2025-11-02T22:49:40Z', 'content': 'AI-powered browsers like ChatGPT Atlas aren’t just browsers with little ChatGPT picture-in-picture boxes off to the side answering questions. They also have “agentic capabilities,” meaning they can t… [+2821 chars]'}",-0.1875,0.5,"['chatgpt atlas aren ’ t', 'chatgpt picture-in-picture boxes', '“ agentic capabilities', '” meaning', 't… [ +2821 chars ]']",34,0.16666666666666666,0.2222222222222222
Gizmodo.com,AJ Dellinger,former openai exec explains why he tried to do a coup against sam altman,Step 1: Ditch Altman. Step 2: Merge with Anthropic. Step 3: ??? Step 4: Profit.,https://gizmodo.com/former-openai-exec-explains-why-he-tried-to-do-a-coup-against-sam-altman-2000680769,2025-11-03 19:25:21+00:00,it’s been nearly two years since openai’s board of directors (very briefly) fired sam altman over a lack of confidence in his abilities at the helm of the company. thanks to the ongoing feud between … [+3201 chars],"{'source': {'id': None, 'name': 'Gizmodo.com'}, 'author': 'AJ Dellinger', 'title': 'Former OpenAI Exec Explains Why He Tried to Do a Coup Against Sam Altman', 'description': 'Step 1: Ditch Altman. Step 2: Merge with Anthropic. Step 3: ??? Step 4: Profit.', 'url': 'https://gizmodo.com/former-openai-exec-explains-why-he-tried-to-do-a-coup-against-sam-altman-2000680769', 'urlToImage': 'https://gizmodo.com/app/uploads/2024/05/415e744638f33d4970f017870929be1d.jpg', 'publishedAt': '2025-11-03T19:25:21Z', 'content': 'It’s been nearly two years since OpenAI’s board of directors (very briefly) fired Sam Altman over a lack of confidence in his abilities at the helm of the company. Thanks to the ongoing feud between … [+3201 chars]'}",0.10000000000000002,0.3444444444444445,"['’ s', 'openai ’ s board', 'sam altman', '… [ +3201 chars ]']",42,0.022727272727272728,0.13636363636363635
Slashdot.org,msmash,"the curious case of the bizarre, disappearing captcha","Captchas have largely vanished from the web in 2025, replaced by invisible tracking systems that analyze user behavior rather than asking people to decipher distorted text or identify traffic lights in image grids. Google launched reCaptcha v3 in 2018 to gene…",https://tech.slashdot.org/story/25/11/03/1916215/the-curious-case-of-the-bizarre-disappearing-captcha,2025-11-03 19:25:00+00:00,"captchas have largely vanished from the web in 2025, replaced by invisible tracking systems that analyze user behavior rather than asking people to decipher distorted text or identify traffic lights … [+861 chars]","{'source': {'id': None, 'name': 'Slashdot.org'}, 'author': 'msmash', 'title': 'The Curious Case of the Bizarre, Disappearing Captcha', 'description': 'Captchas have largely vanished from the web in 2025, replaced by invisible tracking systems that analyze user behavior rather than asking people to decipher distorted text or identify traffic lights in image grids. Google launched reCaptcha v3 in 2018 to gene…', 'url': 'https://tech.slashdot.org/story/25/11/03/1916215/the-curious-case-of-the-bizarre-disappearing-captcha', 'urlToImage': 'https://a.fsdn.com/sd/topics/it_64.png', 'publishedAt': '2025-11-03T19:25:00Z', 'content': 'Captchas have largely vanished from the web in 2025, replaced by invisible tracking systems that analyze user behavior rather than asking people to decipher distorted text or identify traffic lights … [+861 chars]'}",0.21428571428571427,0.42857142857142855,"['analyze user behavior', 'identify traffic lights … [ +861 chars ]']",33,0.11428571428571428,0.2857142857142857
CNET,Scott Stein,apple vision pro's best feature is your avatar. could personas end up on an iphone next? | all things mobile video,"The 3D technology that makes Vision Pro Personas feel realistic is too good to limit to a $3,500 headset.",https://www.cnet.com/videos/apple-vision-pros-best-feature-is-your-avatar-could-personas-end-up-on-an-iphone-next-all-things-mobile/,2025-11-03 13:00:03+00:00,,"{'source': {'id': None, 'name': 'CNET'}, 'author': 'Scott Stein', 'title': ""Apple Vision Pro's Best Feature Is Your Avatar. Could Personas End Up on an iPhone Next? | All Things Mobile video"", 'description': 'The 3D technology that makes Vision Pro Personas feel realistic is too good to limit to a $3,500 headset.', 'url': 'https://www.cnet.com/videos/apple-vision-pros-best-feature-is-your-avatar-could-personas-end-up-on-an-iphone-next-all-things-mobile/', 'urlToImage': 'https://www.cnet.com/a/img/resize/a85a56993dcd9b5d8c7478e828ec7106127263af/hub/2025/10/31/75648c01-ed78-4cf7-b87b-b52c17e31dc0/251031-clean-avp-personas-might-change-how-we-engage-with-our-phones-v2.png?auto=webp&fit=crop&height=675&width=1200', 'publishedAt': '2025-11-03T13:00:03Z', 'content': ''}",0.0,0.0,[],0,0.0,0.0
Mental Floss,Jody Amable,10 classic ‘seinfeld’ episodes that revolve around outdated technology,These devices and practices featured throughout ‘Seinfeld’ are a thing of the past.,https://www.mentalfloss.com/entertainment/tv/classic-seinfeld-episodes-revolve-around-outdated-technology,2025-11-02 23:00:00+00:00,"in its time (1989-1998), seinfeldfamously touted itself as a show about nothing, when in fact it was a show about everything. in 2025, though, it feels more like a show about everything 90s. video re… [+6822 chars]","{'source': {'id': None, 'name': 'Mental Floss'}, 'author': 'Jody Amable', 'title': '10 Classic ‘Seinfeld’ Episodes That Revolve Around Outdated Technology', 'description': 'These devices and practices featured throughout ‘Seinfeld’ are a thing of the past.', 'url': 'https://www.mentalfloss.com/entertainment/tv/classic-seinfeld-episodes-revolve-around-outdated-technology', 'urlToImage': 'https://images2.minutemediacdn.com/image/upload/c_crop,x_506,y_33,w_2435,h_1369/c_fill,w_1440,ar_1440:810,f_auto,q_auto,g_auto/images/GettyImages/mmsport/mentalfloss/01k8xy77djq4bnrsgafc.jpg', 'publishedAt': '2025-11-02T23:00:00Z', 'content': 'In its time (1989-1998), Seinfeldfamously touted itself as a show about nothing, when in fact it was a show about everything. In 2025, though, it feels more like a show about everything 90s. Video re… [+6822 chars]'}",0.5,0.5,['video re… [ +6822 chars ]'],37,0.02564102564102564,0.1282051282051282
